{
  "system": {
    "name": "ChatIAS Pro",
    "version": "2.0.0",
    "environment": "production",
    "strict": true,
    "hotReload": true
  },

  "routing": {
    "intelligent": true,
    "strategies": [
      {
        "id": "by_keywords",
        "type": "keyword_matching",
        "enabled": true,
        "priority": 1
      },
      {
        "id": "by_capabilities",
        "type": "capability_matching",
        "enabled": true,
        "priority": 2
      },
      {
        "id": "by_performance",
        "type": "performance_based",
        "enabled": true,
        "priority": 3
      }
    ]
  },

  "middleware": {
    "chain": [
      {
        "id": "validation",
        "type": "input_validation",
        "enabled": true,
        "order": 1
      },
      {
        "id": "logging",
        "type": "logging",
        "enabled": true,
        "order": 2,
        "config": {
          "logLevel": "info",
          "logFile": "./logs/execution.log"
        }
      },
      {
        "id": "caching",
        "type": "caching",
        "enabled": true,
        "order": 3,
        "config": {
          "ttl": 3600,
          "backend": "memory"
        }
      },
      {
        "id": "rateLimit",
        "type": "rate_limiting",
        "enabled": true,
        "order": 4,
        "config": {
          "requestsPerMinute": 60,
          "burstSize": 10
        }
      },
      {
        "id": "metrics",
        "type": "metrics_collection",
        "enabled": true,
        "order": 5,
        "config": {
          "trackExecutionTime": true,
          "trackErrorRate": true
        }
      }
    ]
  },

  "events": {
    "enabled": true,
    "eventBus": "local",
    "config": {
      "retryFailed": true,
      "maxListeners": 100
    }
  },

  "toolSequences": {
    "analyze_code": {
      "id": "analyze_code",
      "name": "An√°lise Completa de C√≥digo",
      "description": "Analisa c√≥digo em 3 fases: valida√ß√£o de sintaxe, verifica√ß√£o de estilo, extra√ß√£o de depend√™ncias",
      "tags": ["code", "analysis", "complete"],
      "triggeredBy": ["code_analyzer"],

      "steps": [
        {
          "order": 1,
          "tool": "code_executor",
          "action": "validate_syntax",
          "params": {
            "code": "${input.code}",
            "timeout": 5000
          },
          "onSuccess": "continue",
          "onError": "stop",
          "description": "‚úì Valida sintaxe do c√≥digo"
        },
        {
          "order": 2,
          "tool": "code_executor",
          "action": "check_style",
          "params": {
            "code": "${input.code}"
          },
          "onSuccess": "continue",
          "onError": "log_warning",
          "description": "‚úì Verifica estilo e formata√ß√£o"
        },
        {
          "order": 3,
          "tool": "file_reader",
          "action": "extract_dependencies",
          "params": {
            "code": "${input.code}"
          },
          "onSuccess": "continue",
          "onError": "skip",
          "description": "‚úì Extrai depend√™ncias e imports"
        }
      ],

      "errorHandling": {
        "strategy": "fail_fast",
        "retry": {
          "enabled": true,
          "maxRetries": 2,
          "backoffMs": 500
        }
      }
    },

    "process_data": {
      "id": "process_data",
      "name": "Processamento Completo de Dados",
      "description": "Valida, transforma e agrega dados em sequ√™ncia autom√°tica",
      "tags": ["data", "processing", "complete"],
      "triggeredBy": ["data_processor"],

      "steps": [
        {
          "order": 1,
          "tool": "json_parser",
          "action": "parse",
          "params": {
            "json": "${input.data}",
            "strict": true
          },
          "onSuccess": "continue",
          "onError": "stop",
          "description": "‚úì Parse JSON string para objeto"
        },
        {
          "order": 2,
          "tool": "json_parser",
          "action": "validate",
          "params": {
            "data": "${step1.result}",
            "schema": "${input.schema}"
          },
          "onSuccess": "continue",
          "onError": "log_warning",
          "description": "‚úì Valida contra schema"
        }
      ]
    },

    "semantic_analysis": {
      "id": "semantic_analysis",
      "name": "An√°lise Sem√¢ntica com IA",
      "description": "Usa MCP para an√°lise sem√¢ntica avan√ßada com fallback autom√°tico",
      "tags": ["semantic", "ai", "advanced"],
      "triggeredBy": ["code_analyzer"],

      "steps": [
        {
          "order": 1,
          "mcp": "mcp_ollama",
          "action": "analyze",
          "params": {
            "prompt": "Analyze this code for patterns, issues and improvements: ${input.code}",
            "model": "mistral:latest",
            "temperature": 0.3,
            "maxTokens": 2000
          },
          "onSuccess": "continue",
          "onError": "fallback",
          "fallbackMCP": "mcp_openai",
          "description": "ü§ñ An√°lise sem√¢ntica com LLM"
        },
        {
          "order": 2,
          "tool": "json_parser",
          "action": "parse_response",
          "params": {
            "json": "${step1.result}"
          },
          "onSuccess": "continue",
          "onError": "continue",
          "description": "‚úì Parse resposta do LLM"
        }
      ],

      "circuitBreaker": {
        "enabled": true,
        "failureThreshold": 5,
        "successThreshold": 2,
        "timeout": 60000,
        "description": "Protege contra falhas repetidas de MCP"
      }
    }
  },

  "agents": {
    "code_analyzer": {
      "id": "code_analyzer",
      "class": "CodeAnalyzerAgent",
      "file": "code-analyzer.js",
      "enabled": true,
      "version": "1.0.0",

      "description": "Analisa sintaxe, estilo e depend√™ncias de c√≥digo-fonte",
      "tags": ["code", "analysis", "static"],

      "routing": {
        "keywords": [
          "code", "analyze", "syntax", "dependencies", "import", "format", "style", "lint"
        ],
        "priority": 1,
        "minConfidence": 0.7
      },

      "input": {
        "code": { "type": "string", "required": true, "minLength": 1 },
        "language": { "type": "string", "default": "javascript" },
        "depth": { "type": "string", "enum": ["basic", "standard", "deep"], "default": "standard" }
      },

      "capabilities": {
        "syntaxAnalysis": true,
        "styleChecking": true,
        "dependencyTracking": true,
        "patternDetection": true
      },

      "subagents": [
        { "id": "syntax_checker", "class": "SyntaxCheckerAgent" },
        { "id": "code_formatter", "class": "CodeFormatterAgent" },
        { "id": "dependency_analyzer", "class": "DependencyAnalyzerAgent" }
      ],

      "toolSequences": [
        {
          "trigger": "default",
          "sequence": "analyze_code",
          "description": "An√°lise padr√£o: sintaxe ‚Üí estilo ‚Üí depend√™ncias"
        },
        {
          "trigger": "semantic",
          "sequence": "semantic_analysis",
          "description": "An√°lise avan√ßada com IA"
        }
      ],

      "tools": [
        {
          "id": "code_executor",
          "required": true,
          "phase": "validation",
          "priority": 1
        },
        {
          "id": "file_reader",
          "required": false,
          "phase": "analysis",
          "priority": 2
        }
      ],

      "knowledgeBase": [
        { "id": "js_syntax", "priority": "high" },
        { "id": "patterns", "priority": "medium" }
      ],

      "mcp": {
        "optional": ["mcp_ollama", "mcp_openai"],
        "preference": "local",
        "fallback": true
      },

      "sdk": {
        "providers": {
          "local": {
            "enabled": true,
            "models": ["mistral:latest", "llama2:latest"],
            "defaultModel": "mistral:latest",
            "temperature": 0.3,
            "maxTokens": 4000
          },
          "openai": {
            "enabled": false,
            "fallback": true
          }
        }
      },

      "permissions": {
        "readFile": true,
        "writeFile": false,
        "executeCode": true,
        "accessKB": true
      },

      "rateLimit": {
        "enabled": true,
        "requestsPerMinute": 60
      }
    },

    "data_processor": {
      "id": "data_processor",
      "class": "DataProcessorAgent",
      "file": "data-processor.js",
      "enabled": true,
      "version": "1.0.0",

      "description": "Processa, valida e transforma dados estruturados",
      "tags": ["data", "processing", "validation"],

      "routing": {
        "keywords": [
          "data", "json", "validate", "transform", "process", "aggregate"
        ],
        "priority": 2,
        "minConfidence": 0.7
      },

      "input": {
        "data": { "type": ["object", "array", "string"], "required": true },
        "operation": { "type": "string", "enum": ["validate", "transform", "aggregate"] },
        "schema": { "type": "object", "required": false }
      },

      "subagents": [
        { "id": "data_validator", "class": "DataValidatorAgent" },
        { "id": "data_transformer", "class": "DataTransformerAgent" }
      ],

      "toolSequences": [
        {
          "trigger": "default",
          "sequence": "process_data",
          "description": "Processamento autom√°tico: parse ‚Üí validate ‚Üí transform"
        }
      ],

      "tools": [
        {
          "id": "json_parser",
          "required": true,
          "phase": "parsing",
          "priority": 1
        }
      ],

      "knowledgeBase": [
        { "id": "json_schema", "priority": "high" },
        { "id": "data_patterns", "priority": "medium" }
      ],

      "sdk": {
        "providers": {
          "local": {
            "enabled": true,
            "models": ["mistral:latest"],
            "defaultModel": "mistral:latest",
            "temperature": 0.1